{
  "origin": {
    "name": "Talent Garden",
    "lat": 45.44386,
    "lon": 9.20808
  },
  "destination": {
    "name": "viale Isonzo",
    "lat": 45.44658,
    "lon": 9.20584
  },
  "depart_at": "2026-09-26T16:00:00Z",
  "lang": "en",
  "constraints": [
    {
      "kind": "unsignalled_crossings",
      "strength": "require"
    }
  ],
  "detour_tolerance": {
    "min": 5,
    "pct": 25
  },
  "text": "In the mapped area, every way to viale Isonzo has at least one crossing without a signal. So no route there meets the requirement of signals at every crossing. The route with the fewest is route A, 14 minutes, with 1 crossing without a signal. Do you want me to relax the requirement to avoid when possible?",
  "routes": [],
  "compliant_route_available": "no",
  "selected_route_id": null,
  "stop": null,
  "differences": [
    "Signals at every crossing are now required: route A, route B and route C are no longer offered, because of crossings known to have no signal."
  ],
  "facts": [
    {
      "type": "radius",
      "value": 800,
      "unit": "m",
      "source": "unknown",
      "evidence": [],
      "inputs": {
        "graph": {
          "center": [
            45.44386,
            9.20808
          ],
          "dist_m": 800,
          "network_type": "walk",
          "simplify": false,
          "snap": "nearest_edge",
          "snapshot": "2026-09-26",
          "source": "OpenStreetMap via Overpass, osmnx 2.1.1"
        }
      },
      "data_date": "2026-09-26",
      "completeness": "complete"
    },
    {
      "type": "compliant_routes",
      "value": 0,
      "unit": "count",
      "source": "computed",
      "evidence": [
        "node/13306474029"
      ],
      "inputs": {
        "graph": {
          "center": [
            45.44386,
            9.20808
          ],
          "dist_m": 800,
          "network_type": "walk",
          "simplify": false,
          "snap": "nearest_edge",
          "snapshot": "2026-09-26",
          "source": "OpenStreetMap via Overpass, osmnx 2.1.1"
        },
        "origin": [
          45.44386,
          9.20808
        ],
        "destination": [
          45.44658,
          9.20584
        ],
        "speed_m_per_min": 80,
        "origin_snap_m": 41,
        "destination_snap_m": 10,
        "filter": "only crossings mapped as signalled"
      },
      "data_date": "2026-09-26",
      "completeness": "unknown"
    },
    {
      "type": "route_duration",
      "value": 14,
      "unit": "min",
      "source": "computed",
      "evidence": [
        "way/1012491790",
        "way/423494748",
        "way/943943037",
        "way/1074766979",
        "way/1079413421",
        "way/1079413422",
        "way/423495023",
        "way/1079412251",
        "way/1079412252",
        "way/1079412253",
        "way/1079412254",
        "way/1057832021",
        "way/1012734059"
      ],
      "inputs": {
        "graph": {
          "center": [
            45.44386,
            9.20808
          ],
          "dist_m": 800,
          "network_type": "walk",
          "simplify": false,
          "snap": "nearest_edge",
          "snapshot": "2026-09-26",
          "source": "OpenStreetMap via Overpass, osmnx 2.1.1"
        },
        "origin": [
          45.44386,
          9.20808
        ],
        "destination": [
          45.44658,
          9.20584
        ],
        "speed_m_per_min": 80,
        "origin_snap_m": 41,
        "destination_snap_m": 10,
        "filter": "fewest crossings known to have no signal, then shortest"
      },
      "data_date": "2026-09-26",
      "completeness": "complete"
    },
    {
      "type": "route_violating_crossings",
      "value": 1,
      "unit": "count",
      "source": "computed",
      "evidence": [
        "node/2942696591"
      ],
      "inputs": {
        "graph": {
          "center": [
            45.44386,
            9.20808
          ],
          "dist_m": 800,
          "network_type": "walk",
          "simplify": false,
          "snap": "nearest_edge",
          "snapshot": "2026-09-26",
          "source": "OpenStreetMap via Overpass, osmnx 2.1.1"
        },
        "origin": [
          45.44386,
          9.20808
        ],
        "destination": [
          45.44658,
          9.20584
        ],
        "speed_m_per_min": 80,
        "origin_snap_m": 41,
        "destination_snap_m": 10,
        "filter": "fewest crossings known to have no signal, then shortest"
      },
      "data_date": "2026-09-26",
      "completeness": "complete"
    },
    {
      "type": "route_unknown_crossings",
      "value": 0,
      "unit": "count",
      "source": "computed",
      "evidence": [
        "way/1012491790",
        "way/423494748",
        "way/943943037",
        "way/1074766979",
        "way/1079413421",
        "way/1079413422",
        "way/423495023",
        "way/1079412251",
        "way/1079412252",
        "way/1079412253",
        "way/1079412254",
        "way/1057832021",
        "way/1012734059"
      ],
      "inputs": {
        "graph": {
          "center": [
            45.44386,
            9.20808
          ],
          "dist_m": 800,
          "network_type": "walk",
          "simplify": false,
          "snap": "nearest_edge",
          "snapshot": "2026-09-26",
          "source": "OpenStreetMap via Overpass, osmnx 2.1.1"
        },
        "origin": [
          45.44386,
          9.20808
        ],
        "destination": [
          45.44658,
          9.20584
        ],
        "speed_m_per_min": 80,
        "origin_snap_m": 41,
        "destination_snap_m": 10,
        "filter": "fewest crossings known to have no signal, then shortest"
      },
      "data_date": "2026-09-26",
      "completeness": "complete"
    }
  ],
  "unknown": [
    "Routes that leave the mapped area, 800 m around Talent Garden, were not considered.",
    "Crossings at points where the map has no crossing are not counted.",
    "For most crossings the map does not say whether the signal has sound."
  ],
  "meta": {
    "mode": "offline",
    "cache": "hit",
    "computed_at": "2026-09-26T09:50:56Z"
  }
}
